{
  "apiVersion": "modos.pleiades/v1alpha1",
  "kind": "OperatorInputCandidate",
  "candidateId": "operator-input-candidate:synthetic-ready-0001",
  "sourceCommit": "1111111111111111111111111111111111111111",
  "createdAt": "2026-07-20T23:15:00Z",
  "inputs": {
    "privateEcology": {"supplied": true, "classification": "private-reference", "artifactRef": "urn:pleiades:private:ecology:synthetic-0001", "artifactDigest": "sha256:aaaaaaaaaaaaaaaaaaaaaaaaaaaaaaaaaaaaaaaaaaaaaaaaaaaaaaaaaaaaaaaa", "receiptDigest": "sha256:bbbbbbbbbbbbbbbbbbbbbbbbbbbbbbbbbbbbbbbbbbbbbbbbbbbbbbbbbbbbbbbb", "embeddedPayload": false, "privateKeyMaterialIncluded": false, "externalSideEffectApplied": false},
    "observedInventory": {"supplied": true, "classification": "private-reference", "artifactRef": "urn:pleiades:private:inventory:synthetic-0001", "artifactDigest": "sha256:cccccccccccccccccccccccccccccccccccccccccccccccccccccccccccccccc", "receiptDigest": "sha256:dddddddddddddddddddddddddddddddddddddddddddddddddddddddddddddddd", "embeddedPayload": false, "privateKeyMaterialIncluded": false, "externalSideEffectApplied": false},
    "nodeInventory": {"supplied": true, "classification": "live-evidence", "artifactRef": "urn:pleiades:artifact:nodes:synthetic-0001", "artifactDigest": "sha256:eeeeeeeeeeeeeeeeeeeeeeeeeeeeeeeeeeeeeeeeeeeeeeeeeeeeeeeeeeeeeeee", "receiptDigest": "sha256:ffffffffffffffffffffffffffffffffffffffffffffffffffffffffffffffff", "embeddedPayload": false, "privateKeyMaterialIncluded": false, "externalSideEffectApplied": false},
    "signingIdentity": {"supplied": true, "classification": "sovereign-decision", "artifactRef": "urn:pleiades:receipt:signing-identity:synthetic-0001", "artifactDigest": "sha256:1111111111111111111111111111111111111111111111111111111111111111", "receiptDigest": "sha256:2222222222222222222222222222222222222222222222222222222222222222", "embeddedPayload": false, "privateKeyMaterialIncluded": false, "externalSideEffectApplied": false},
    "historyDecision": {"supplied": true, "classification": "sovereign-decision", "artifactRef": "urn:pleiades:receipt:history-decision:synthetic-0001", "artifactDigest": "sha256:3333333333333333333333333333333333333333333333333333333333333333", "receiptDigest": "sha256:4444444444444444444444444444444444444444444444444444444444444444", "embeddedPayload": false, "privateKeyMaterialIncluded": false, "externalSideEffectApplied": false},
    "authorityGrant": {"supplied": true, "classification": "sovereign-decision", "artifactRef": "urn:pleiades:receipt:grant-proposal:synthetic-0001", "artifactDigest": "sha256:5555555555555555555555555555555555555555555555555555555555555555", "receiptDigest": "sha256:6666666666666666666666666666666666666666666666666666666666666666", "embeddedPayload": false, "privateKeyMaterialIncluded": false, "externalSideEffectApplied": false},
    "canaryPlan": {"supplied": true, "classification": "live-evidence", "artifactRef": "urn:pleiades:artifact:canary-plan:synthetic-0001", "artifactDigest": "sha256:7777777777777777777777777777777777777777777777777777777777777777", "receiptDigest": "sha256:8888888888888888888888888888888888888888888888888888888888888888", "embeddedPayload": false, "privateKeyMaterialIncluded": false, "externalSideEffectApplied": false},
    "observationPlan": {"supplied": true, "classification": "live-evidence", "artifactRef": "urn:pleiades:artifact:observation-plan:synthetic-0001", "artifactDigest": "sha256:9999999999999999999999999999999999999999999999999999999999999999", "receiptDigest": "sha256:aaaaaaaaaaaaaaaaaaaaaaaaaaaaaaaaaaaaaaaaaaaaaaaaaaaaaaaaaaaaaaaa", "embeddedPayload": false, "privateKeyMaterialIncluded": false, "externalSideEffectApplied": false}
  },
  "decisions": {"historyRewrite": "declined", "authorizationRef": "urn:pleiades:receipt:history-decision:synthetic-0001", "planDigest": "sha256:bbbbbbbbbbbbbbbbbbbbbbbbbbbbbbbbbbbbbbbbbbbbbbbbbbbbbbbbbbbbbbbb"},
  "selections": {"canaryNodeId": "node:synthetic-canary-01", "observationWindowSeconds": 86400},
  "requestedOutputs": ["private-closure-candidate", "history-rewrite-decision-record", "node-admission-candidate", "grant-issuance-proposal", "canary-admission-plan", "observation-window-plan", "next-progression-candidate"],
  "authority": {"ceiling": "none", "proposalOnly": true, "canonicalMutationApplied": false, "liveExecutionApplied": false, "historyRewriteApplied": false, "grantIssued": false}
}
